,user,sentiment_score,sentiment_magnitude,location,full_text,time_stamp,geocode,address,state
288,macartisan,0.10000000149,0.20000000298,Seattle,"Louis C.K. Crossed a Line Into Sexual Misconduct, 5 Women Say https://t.co/03Lg9WNfQB",2017-11-15 02:02:46,"(Seattle, King County, Washington, United States of America, (47.6038321, -122.3300624))","Seattle, King County, Washington, United States of America",Washington
289,TheRomit,-0.10000000149,0.10000000149,"Cupertino, CA",The Apple TV App Store is so overlooked that Louis C.K.’s app still has the second featured spot on the “New Apps We Love” section of the Featured page — five days after he released a statement admitting to his inappropriate and harmful behavior.,2017-11-15 01:59:16,"(Cupertino, Santa Clara County, California, United States of America, (37.3230107, -122.0322519))","Cupertino, Santa Clara County, California, United States of America",California
290,drwendyhatton,0.0,0.40000000596,"Florida, USA but I'm English",'Completely indefensible.' John Oliver showed no mercy for Louis C.K. on 'Last Week Tonight' https://t.co/xPJwgmpjoz,2017-11-15 03:06:03,"(English Peak Court, Jacksonville, Duval County, Florida, 32259, United States of America, (30.1262984, -81.5311439))","English Peak Court, Jacksonville, Duval County, Florida, 32259, United States of America",Florida
291,ghostdrive,0.10000000149,0.10000000149,Texas,"I Love You, Daddy is a disgusting film—an act of cinematic gaslighting that, even apart from Louis C.K.'s misconduct, should never have been acquired for distribution in the first place: https://t.co/dUJpiy0nod",2017-11-15 03:02:03,"(Texas, United States of America, (31.8160381, -99.5120986))","Texas, United States of America",Texas
292,HorsePajamas,0.20000000298,0.5,by myself,"This is the first part of what @marcmaron had to say on @wtfpod about his friend, Louis C.K. Every word is worth the read: https://t.co/WXyUZIzrg1",2017-11-15 03:02:02,,,
293,katefoxx15,-0.40000000596,0.899999976158,"Houston, TX","Stewart’s problem is that a video from May of 2016 is making the rounds on social media, a video where the former Daily Show host is asked about and then dismisses the stories about C.K.’s appalling behavior. https://t.co/TRvciLEEKr",2017-11-15 03:01:23,"(Houston, Harris County, Texas, 77002, United States of America, (29.7589382, -95.3676974))","Houston, Harris County, Texas, 77002, United States of America",Texas
294,kaleighlogoglu5,-0.600000023842,0.600000023842,"Denpasar Barat, Indonesia","Latest:  FX Drops Louis C.K. from All Projects, Cancels Overall Deal https://t.co/Ydx14OmFKR #News #MovieTVTechGeeks https://t.co/8NCpRNox0B",2017-11-15 03:00:33,"(Jalan Denpasar, Antapani Tengah, Jawa Barat, 40291, Indonesia, (-6.9236903, 107.6614738))","Jalan Denpasar, Antapani Tengah, Jawa Barat, 40291, Indonesia",
295,krismiranda09,-0.40000000596,0.899999976158,"Los Angeles, CA","""I’m tired of trying to explain why none of this is sex. Why it hurts the way violence hurts” — @lizmeriwether on Louis C.K. and America’s epidemic https://t.co/LyWax3Q8BA",2017-11-15 03:00:23,"(LA, Los Angeles County, California, United States of America, (34.054935, -118.244476))","LA, Los Angeles County, California, United States of America",California
296,spdgtkt87,0.0,0.0,"Maryland, USA",Louis C.K.’s former manager is leaping off the comedian’s sinking ship as quickly as possible https://t.co/x1TiOr82eV,2017-11-15 02:58:05,"(Maryland, United States of America, (39.5162234, -76.9382069))","Maryland, United States of America",Maryland
297,alicahilyard291,-0.600000023842,0.600000023842,Turkey,"Latest:  FX Drops Louis C.K. from All Projects, Cancels Overall Deal https://t.co/Ydx14OmFKR #News #MovieTVTechGeeks https://t.co/8NCpRNox0B",2017-11-15 02:57:08,"(Türkiye, (38.9597594, 34.9249653))",Türkiye,
298,jennimi,0.20000000298,0.5,"back row, all the way left","This is the first part of what @marcmaron had to say on @wtfpod about his friend, Louis C.K. Every word is worth the read: https://t.co/WXyUZIzrg1",2017-11-15 02:55:43,,,
299,SheeGhee,-0.600000023842,0.600000023842,California,"With television’s golden age tarnished by Louis C.K., Kevin Spacey and others, the medium’s brightest era has gone dark: https://t.co/SlN9RMu8U0 https://t.co/f5VNi801QH",2017-11-15 02:54:52,"(California, United States of America, (36.7014631, -118.7559974))","California, United States of America",California
300,straitarrow10,-0.20000000298,0.800000011921,"Shelton, WA","And suddenly, with this Louis C.K. news, I’m right back to the hopeless feelings I had last year after the election. It’s hard to be sure that there are still some good people anymore...maybe I shouldn’t have looked up to comedians as good people at all but just, wow...",2017-11-15 04:07:16,"(Shelton, Mason County, Washington, United States of America, (47.2150945, -123.1007066))","Shelton, Mason County, Washington, United States of America",Washington
301,lyndamurphy1055,0.0,0.0,New Jersey,"Jon Stewart addresses Louis C.K.'s controversy, hints at misconduct at NBC
https://t.co/h5Hh7RfgGv",2017-11-15 04:07:14,"(New Jersey, United States of America, (40.0757384, -74.4041622))","New Jersey, United States of America",New Jersey
302,RamonThomas,0.10000000149,1.10000002384,South Africa,"#JonStewart Friends List so far:

Anthony Weiner
Louis CK

Both good friends he knew nothing about.

Food for thought?
 https://t.co/Cmb153DveI",2017-11-15 04:07:02,"(South Africa, (-28.8166236, 24.991639))",South Africa,
303,audreaharris191,-0.300000011921,0.899999976158,"Giza, Egypt",what in the hell happened to the men in our country to lower their tolerance levels and feel this crap was okay at the time? #LouisCK #metoo https://t.co/Rl4acSCvQC #onlylove,2017-11-15 04:06:03,"(الجيزة, محافظة الجيزة‎, 12541, مصر, (30.0170059, 31.2134513))","الجيزة, محافظة الجيزة‎, 12541, مصر",
304,7777Bluebird,0.0,0.0,Gulf Coast State,"Jon Stewart addresses Louis C.K.'s controversy, hints at misconduct at NBC
https://t.co/h5Hh7RfgGv",2017-11-15 04:05:30,"(Gulf Coast, Gulf Harbor, Collier County, Florida, 34109, United States of America, (26.301135, -81.797742))","Gulf Coast, Gulf Harbor, Collier County, Florida, 34109, United States of America",Florida
305,ExhibitAsTheyR,0.0,0.0,"Mandarin, FL","Jon Stewart addresses Louis C.K.'s controversy, hints at misconduct at NBC
https://t.co/h5Hh7RfgGv",2017-11-15 04:04:50,"(Mandarin, Duval County, Florida, 32223, United States of America, (30.1605186, -81.6592596))","Mandarin, Duval County, Florida, 32223, United States of America",Florida
306,emilypassey,-0.40000000596,0.899999976158,"Eagle Mountain, UT","Stewart’s problem is that a video from May of 2016 is making the rounds on social media, a video where the former Daily Show host is asked about and then dismisses the stories about C.K.’s appalling behavior. https://t.co/TRvciLEEKr",2017-11-15 04:04:36,"(Eagle Mountain, Utah County, Utah, 84005, United States of America, (40.3066676, -112.0147617))","Eagle Mountain, Utah County, Utah, 84005, United States of America",Utah
307,KjaerJesper,-0.600000023842,1.20000004768,Denmark.,@FoxNews This is so annoying. I really like louis C.K - but why could he not see that what he was doing was wrong?,2017-11-15 04:04:28,"(Danmark, (55.670249, 10.3333283))",Danmark,
308,parnell_zack,0.0,0.0,"Calabash, NC","FoxNews: Jon Stewart addresses Louis C.K.'s controversy, hints at misconduct at NBC
https://t.co/t8l2FC9YxD",2017-11-15 04:04:14,"(Calabash, Brunswick County, North Carolina, United States of America, (33.8907278, -78.5683446))","Calabash, Brunswick County, North Carolina, United States of America",North Carolina
309,g_ashleyhawkins,0.0,0.0,"New York, NY","Jon Stewart addresses Louis C.K.'s controversy, hints at misconduct at NBC
https://t.co/pWATt0D5eQ",2017-11-15 04:04:12,"(NYC, New York, United States of America, (40.7306458, -73.9866136))","NYC, New York, United States of America",New York
310,Robkishere,-0.20000000298,0.20000000298,Worldwide,Louis C.K.’s Half-Hearted Apology Was Just Skewered by ‘Game of Thrones’ Star Lena Headey - https://t.co/aleyOOKJV6,2017-11-15 06:07:10,"(Worldwide, Crescent Road, Crumpsall, Manchester, Greater Manchester, North West England, England, M8 5EJ, UK, (53.5120412, -2.2434612))","Worldwide, Crescent Road, Crumpsall, Manchester, Greater Manchester, North West England, England, M8 5EJ, UK",
311,EamonGa,0.20000000298,0.5,"Phila, Pa","This is the first part of what @marcmaron had to say on @wtfpod about his friend, Louis C.K. Every word is worth the read: https://t.co/WXyUZIzrg1",2017-11-15 06:07:07,"(Phila-Great Bend Turnpike, Fleetville, Lackawanna County, Pennsylvania, 18414-9785, United States of America, (41.624678, -75.7099711))","Phila-Great Bend Turnpike, Fleetville, Lackawanna County, Pennsylvania, 18414-9785, United States of America",Pennsylvania
312,beadbear,0.0,0.0,New Orleans,"On Louis C.K., Jon Stewart falls short of liberal reputation https://t.co/B07eyZvGr2",2017-11-15 06:06:37,"(New Orleans, Orleans Parish, Louisiana, United States of America, (29.9499323, -90.0701156))","New Orleans, Orleans Parish, Louisiana, United States of America",Louisiana
313,alainewenderwi5,-0.600000023842,0.600000023842,"Egmore Nungambakkam, India","Latest:  FX Drops Louis C.K. from All Projects, Cancels Overall Deal https://t.co/Ydx14OmFKR #News #MovieTVTechGeeks https://t.co/8NCpRNox0B",2017-11-15 06:06:16,"(Egmore, Zone 7 Nungambakkam, Corporation of Chennai, Chennai district, Tamil Nadu, 600008, India, (13.0728321, 80.2576906))","Egmore, Zone 7 Nungambakkam, Corporation of Chennai, Chennai district, Tamil Nadu, 600008, India",
314,dakotaself1088,-0.600000023842,0.600000023842,"Region of Altai, Russia","Latest:  FX Drops Louis C.K. from All Projects, Cancels Overall Deal https://t.co/Ydx14OmFKR #News #MovieTVTechGeeks https://t.co/8NCpRNox0B",2017-11-15 06:05:58,"(Алтайский край, СФО, РФ, (52.6932243, 82.6931424))","Алтайский край, СФО, РФ",
315,jtk236833,-0.300000011921,1.10000002384,EVERYWHERE,"Jon Stewart admits that ‘sexual harassment is rampant in Hollywood’

Hmm...and they’re the ones preaching to us? https://t.co/yXxeA9HGGO",2017-11-15 06:04:22,"(Everything Everywhere, Chadwick Street, Steander, Hunslet, Leeds, Yorkshire and the Humber, England, LS9 8NB, UK, (53.78984315, -1.53394231075))","Everything Everywhere, Chadwick Street, Steander, Hunslet, Leeds, Yorkshire and the Humber, England, LS9 8NB, UK",
316,asianorfleet982,-0.600000023842,0.600000023842,Tunisia,"Latest:  FX Drops Louis C.K. from All Projects, Cancels Overall Deal https://t.co/Ydx14OmFKR #News #MovieTVTechGeeks https://t.co/8NCpRNox0B",2017-11-15 06:02:36,"(تونس, (33.8439408, 9.400138))",تونس,
317,Kartikeh,-0.10000000149,0.10000000149,New York,The Apple TV App Store is so overlooked that Louis C.K.’s app still has the second featured spot on the “New Apps We Love” section of the Featured page — five days after he released a statement admitting to his inappropriate and harmful behavior.,2017-11-15 06:01:53,"(NYC, New York, United States of America, (40.7306458, -73.9866136))","NYC, New York, United States of America",New York
318,paulbulbul2372,-0.300000011921,0.899999976158,"Ankara, Trkiye",what in the hell happened to the men in our country to lower their tolerance levels and feel this crap was okay at the time? #LouisCK #metoo https://t.co/Rl4acSCvQC #onlylove,2017-11-15 06:00:39,,,
319,clarityhaynes,0.0,0.0,"New York, NY",The 2017 revolution no one saw coming | Will Bunch https://t.co/qrpkeLSVQR via @phillydotcom,2017-11-15 06:00:19,"(NYC, New York, United States of America, (40.7306458, -73.9866136))","NYC, New York, United States of America",New York
320,SusanWiseBauer,0.0,0.5,Virginia,"""[I]n American public discourse, moral violations require explicit accounts of trespass and displays of remorse from those who hope to get back in the public’s good graces."" ART OF THE PUBLIC GROVEL still applies... https://t.co/GDPlQ6ERML",2017-11-15 07:05:41,"(Virginia, United States of America, (37.1232245, -78.4927721))","Virginia, United States of America",Virginia
321,YvonneCorcoranN,0.20000000298,0.899999976158,Australia,"#JonStewart 'Stunned' About Louis C.K., Wonders 'Did I Miss Something?' - HuffPost Australia - You need to ask ? https://t.co/PguxDARGhN",2017-11-15 07:05:39,"(Australia, (-24.7761086, 134.755))",Australia,
322,InsideTrackBH,0.600000023842,1.29999995232,"Boston, MA","It’s fin for Louis C.K. film overseas: ‘I Love You, Daddy’ pulled in France, Middle East https://t.co/UFyTM0lsQd https://t.co/H4hzVTgxZG",2017-11-15 07:05:15,"(Boston, Suffolk, Massachusetts, United States of America, (42.3604823, -71.0595678))","Boston, Suffolk, Massachusetts, United States of America",Massachusetts
323,AlfredoZaragoz0,-0.600000023842,0.600000023842,U.S.A.,"With television’s golden age tarnished by Louis C.K., Kevin Spacey and others, the medium’s brightest era has gone dark: https://t.co/SlN9RMu8U0 https://t.co/f5VNi801QH",2017-11-15 07:05:03,"(U.S.A, Depósito de Evaporación Solar  El Caracol, Ecatepec de Morelos, Estado de México, 55107, México, (19.5584043, -99.0277414))","U.S.A, Depósito de Evaporación Solar  El Caracol, Ecatepec de Morelos, Estado de México, 55107, México",
324,BobbyJoe1956,-0.40000000596,0.899999976158,"Independence, MO","Stewart’s problem is that a video from May of 2016 is making the rounds on social media, a video where the former Daily Show host is asked about and then dismisses the stories about C.K.’s appalling behavior. https://t.co/TRvciLEEKr",2017-11-15 07:04:40,"(Independence, Jackson County, Missouri, United States of America, (39.0911161, -94.4155068))","Independence, Jackson County, Missouri, United States of America",Missouri
325,rchickentheater,-0.20000000298,0.899999976158,Duluth,"I think I'm using the new park app wrong. I clicked ""Accept"" and now my car is dating Louis C.K.",2017-11-15 07:04:11,"(Duluth, Saint Louis County, Minnesota, United States of America, (46.7729322, -92.1251218))","Duluth, Saint Louis County, Minnesota, United States of America",Minnesota
326,Inkdnaija,0.300000011921,1.10000002384,"Washington, DC",Jon Stewart Gets Honest About Not Believing Louis C.K. Sexual Misconduct Rumors: ‘You Get Mad at Yourself’ https://t.co/WSIEQI3i7f https://t.co/JM7d24v9yU,2017-11-15 07:03:42,"(Washington, District of Columbia, United States of America, (38.8949549, -77.0366456))","Washington, District of Columbia, United States of America",District of Columbia
327,prymefocus,0.0,0.40000000596,"Washington, DC",Marc Maron Says Louis C.K. Lied to Him About Sexual Misconduct Allegations https://t.co/V8j51DMnUB https://t.co/tzE9WEIIqv,2017-11-15 07:03:15,"(Washington, District of Columbia, United States of America, (38.8949549, -77.0366456))","Washington, District of Columbia, United States of America",District of Columbia
328,cinrui,-0.300000011921,0.899999976158,"Almond, NC","Louis C.K., who sexually harassed Sarah Palin, was invited to be a guest of honor by members of the D.C. press.

https://t.co/dEzvvrVcSd",2017-11-15 07:03:13,"(Almond, Sol Plaatje Ward 14, Kimberley, Frances Baard District Municipality, Northern Cape, 8301, South Africa, (-28.7218131, 24.7632377))","Almond, Sol Plaatje Ward 14, Kimberley, Frances Baard District Municipality, Northern Cape, 8301, South Africa",
329,florenescott275,-0.300000011921,0.899999976158,Riyadh,what in the hell happened to the men in our country to lower their tolerance levels and feel this crap was okay at the time? #LouisCK #metoo https://t.co/Rl4acSCvQC #onlylove,2017-11-15 07:03:00,"(Riyadh, الخرطوم, 11114, السودان, (15.5835188, 32.5677069))","Riyadh, الخرطوم, 11114, السودان",
330,redsox7853,-0.20000000298,0.20000000298,Field of Dreams,Awkward viewing: Jon Stewart and David Axelrod's handling of question about Louis C.K. in 2016 https://t.co/XWbarJQisD,2017-11-15 08:05:55,"(Field of Dreams, Hamden, New Haven County, Connecticut, 06514, United States of America, (41.3966043, -72.9451918667))","Field of Dreams, Hamden, New Haven County, Connecticut, 06514, United States of America",Connecticut
331,mist3rcod33,0.10000000149,0.10000000149,Skynet,"Louis C.K.’s new movie perfectly defines the trash fire that is 2017, even if you never see it: https://t.co/ihJOUQ2OaV https://t.co/EObLFqIrTU",2017-11-15 08:05:19,"(Skynet, Veraville Townhomes Classic, Talon Singko, Las Piñas, District 2, Las Piñas, Metro Manila, 1747, Philippines, (14.4284028, 120.9994547))","Skynet, Veraville Townhomes Classic, Talon Singko, Las Piñas, District 2, Las Piñas, Metro Manila, 1747, Philippines",
332,varley_craig,-0.40000000596,0.40000000596,Canaan VT,Louis C.K. is in deep shit https://t.co/3mF7vNhSXY,2017-11-15 08:04:31,"(Canaan, Essex County, Vermont, United States of America, (44.996368, -71.538849))","Canaan, Essex County, Vermont, United States of America",Vermont
333,EZitrin,0.0,1.5,San Francisco,"Where would we be this season without Lindy West? Way far behind &amp; confused. Boom! comedy, men, Louis C.K. https://t.co/IaiR2yZi1W",2017-11-15 08:04:27,"(San Francisco, Agusan del Sur, Caraga, Philippines, (8.444585, 125.951249185))","San Francisco, Agusan del Sur, Caraga, Philippines",
334,Lilpoo404,0.20000000298,0.20000000298,USA !!!!!,Hypocrites - Alec Baldwin and Louis C.K.: 'Saturday Night Live' Is Part of the Problem https://t.co/Coawbj5e7l,2017-11-15 08:03:45,"(United States of America, (39.7837304, -100.4458825))",United States of America,
335,screencrushnews,0.10000000149,0.10000000149,New York,"Louis C.K.’s new movie perfectly defines the trash fire that is 2017, even if you never see it: https://t.co/ihJOUQ2OaV https://t.co/EObLFqIrTU",2017-11-15 08:03:15,"(NYC, New York, United States of America, (40.7306458, -73.9866136))","NYC, New York, United States of America",New York
336,mikejovi,-0.40000000596,0.40000000596,Texas,Louis C.K. is in deep shit https://t.co/3mF7vNhSXY,2017-11-15 08:02:43,"(Texas, United States of America, (31.8160381, -99.5120986))","Texas, United States of America",Texas
337,LooneyLaneFans,0.300000011921,0.300000011921,worldwide,Lena Headey's Response To Louis C.K.'s Apology Is Cersei Lannister Level Savage https://t.co/RVW8cZccEw,2017-11-15 08:00:05,"(Worldwide, Crescent Road, Crumpsall, Manchester, Greater Manchester, North West England, England, M8 5EJ, UK, (53.5120412, -2.2434612))","Worldwide, Crescent Road, Crumpsall, Manchester, Greater Manchester, North West England, England, M8 5EJ, UK",
338,DixieLaite,-0.20000000298,0.20000000298,Manhattan!,Awkward viewing: Jon Stewart and David Axelrod's handling of question about Louis C.K. in 2016 https://t.co/XWbarJQisD,2017-11-15 07:59:38,"(Manhattan, NYC, New York, 83, United States of America, (40.7902778, -73.9597222))","Manhattan, NYC, New York, 83, United States of America",New York
339,GerryCallahan,-0.20000000298,0.20000000298,"Boston, MA",Awkward viewing: Jon Stewart and David Axelrod's handling of question about Louis C.K. in 2016 https://t.co/XWbarJQisD,2017-11-15 07:58:14,"(Boston, Suffolk, Massachusetts, United States of America, (42.3604823, -71.0595678))","Boston, Suffolk, Massachusetts, United States of America",Massachusetts
340,Lord_0f_Lords,-0.600000023842,0.600000023842,North Hollywood,"With television’s golden age tarnished by Louis C.K., Kevin Spacey and others, the medium’s brightest era has gone dark: https://t.co/SlN9RMu8U0 https://t.co/f5VNi801QH",2017-11-15 09:07:15,"(North Hollywood, LA, Los Angeles County, California, 91601-3121, United States of America, (34.1729044, -118.3740371))","North Hollywood, LA, Los Angeles County, California, 91601-3121, United States of America",California
341,jasmine01980434,-0.600000023842,0.600000023842,"Hanoi, Vietnam","Latest:  FX Drops Louis C.K. from All Projects, Cancels Overall Deal https://t.co/Ydx14OmFKR #News #MovieTVTechGeeks https://t.co/8NCpRNox0B",2017-11-15 09:07:13,"(Hà Nội, Việt Nam, (21.0292095, 105.85247))","Hà Nội, Việt Nam",
342,JSCram3254,0.20000000298,0.899999976158,"Philadelphia, PA","Game on!

Still blown away by the 26 year-old lesbian wining in Oklahoma last night.  It is a revolution! https://t.co/KiQw9FRoVM",2017-11-15 09:07:09,"(Philadelphia, Philadelphia County, Pennsylvania, United States of America, (39.9523993, -75.1635899))","Philadelphia, Philadelphia County, Pennsylvania, United States of America",Pennsylvania
343,Trumptbird,-0.300000011921,1.10000002384,U.S.A.,"Jon Stewart admits that ‘sexual harassment is rampant in Hollywood’

Hmm...and they’re the ones preaching to us? https://t.co/yXxeA9HGGO",2017-11-15 09:06:51,"(U.S.A, Depósito de Evaporación Solar  El Caracol, Ecatepec de Morelos, Estado de México, 55107, México, (19.5584043, -99.0277414))","U.S.A, Depósito de Evaporación Solar  El Caracol, Ecatepec de Morelos, Estado de México, 55107, México",
344,hurryprimaries,0.20000000298,0.899999976158,"Sacramento, CA","Game on!

Still blown away by the 26 year-old lesbian wining in Oklahoma last night.  It is a revolution! https://t.co/KiQw9FRoVM",2017-11-15 09:06:49,"(Sacramento, Sacramento County, California, United States of America, (38.5815719, -121.4943996))","Sacramento, Sacramento County, California, United States of America",California
345,vulture,0.10000000149,0.20000000298,New York City,In which @jadabird goes through her old write-up on #ILoveYouDaddy and reexamines it through the lens of what we know about Louis C.K. now https://t.co/l1DHpTTdk8,2017-11-15 09:06:36,"(NYC, New York, United States of America, (40.7306458, -73.9866136))","NYC, New York, United States of America",New York
346,DwayneAnthonyP,0.20000000298,0.899999976158,Destin FL,"Game on!

Still blown away by the 26 year-old lesbian wining in Oklahoma last night.  It is a revolution! https://t.co/KiQw9FRoVM",2017-11-15 09:06:24,"(Destin, Okaloosa County, Florida, United States of America, (30.3935337, -86.4957834))","Destin, Okaloosa County, Florida, United States of America",Florida
347,GordonStrother,0.0,1.60000002384,The TwiTlight Zone,"There’s an old Louis C.K. joke that starts: “Divorce is always good news. I know that sounds weird, but it’s true, because no good marriage has ever ended in divorce.”
Why Men Aren’t Funny https://t.co/Whvepys2Tz",2017-11-15 09:05:55,,,
348,bybpod,0.10000000149,0.5,"Nashville,TN","🆕 #fakeassradio 📻
EPISODE 97 - NO MORE POLITICS
-iPhone X
-Louis C.K.
-#BoycottKeurig 
-so much more

https://t.co/jrylHX7O1w",2017-11-15 09:05:53,"(Nashville-Davidson, Davidson County, Tennessee, United States of America, (36.1622296, -86.7743531))","Nashville-Davidson, Davidson County, Tennessee, United States of America",Tennessee
349,RahjBobby,0.20000000298,0.899999976158,Indiana,"Game on!

Still blown away by the 26 year-old lesbian wining in Oklahoma last night.  It is a revolution! https://t.co/KiQw9FRoVM",2017-11-15 09:05:52,"(Indiana, United States of America, (40.3270127, -86.1746933))","Indiana, United States of America",Indiana
350,tcxtkpwbss1336,-0.300000011921,0.899999976158,Kannur-Padanapalam-Talap,what in the hell happened to the men in our country to lower their tolerance levels and feel this crap was okay at the time? #LouisCK #metoo https://t.co/Rl4acSCvQC #onlylove,2017-11-15 10:06:31,,,
351,FLAREfashion,0.0,0.0,Canada,"⚡️ Here's How Poet @isobelohare ""Fixed"" Louis C.K.'s Statement https://t.co/7YS9hPjR1j",2017-11-15 10:05:15,"(Canada, (61.0666922, -107.9917071))",Canada,
352,4thp,0.20000000298,0.899999976158,4thp,"Game on!

Still blown away by the 26 year-old lesbian wining in Oklahoma last night.  It is a revolution! https://t.co/KiQw9FRoVM",2017-11-15 10:05:12,,,
353,bsmithers,-0.20000000298,1.70000004768,"Edinburgh, Scotland",@Veachanderthal @JohnRom34105020 @Nick_Falco @ChuckNASCAR Now it’s all petty one upmanship going on. What Weinstein/spacey/Louis C.K. has done is indefensible but others like the president and Moore are swept under the carpet. Fox News being the worst culprits. It’s time people took ownership of their mistakes.,2017-11-15 10:04:52,"(City of Edinburgh, Scotland, UK, (55.9495628, -3.1914972))","City of Edinburgh, Scotland, UK",
354,colettaappleto6,-0.300000011921,0.899999976158,"Udon Thani Province, Thailand",what in the hell happened to the men in our country to lower their tolerance levels and feel this crap was okay at the time? #LouisCK #metoo https://t.co/Rl4acSCvQC #onlylove,2017-11-15 10:04:32,"(จังหวัดอุดรธานี, ประเทศไทย, (17.5211917, 102.6680012))","จังหวัดอุดรธานี, ประเทศไทย",
355,HardR_DSA,0.40000000596,0.800000011921,"Silverlake, Los Angeles","Harvey Weinstein Reminds Me of My Rabbi
Roman Polanski Reminds Me of My Rabbi
Woody Allen Reminds Me of My Rabbi
Brian Singer Reminds Me of My Rabbi
Louis C.K. Reminds Me of My Rabbi
Jeffery Epstein Reminds Me of My Rabbi
Brett Ratner Reminds Me of My Rabbi
Emmett Rensin Reminds",2017-11-15 10:03:24,"(Silverlake Ramen, 2927, Sunset Boulevard, Silver Lake, Angelino Heights, LA, Los Angeles County, California, 90026, United States of America, (34.0835496, -118.2736706))","Silverlake Ramen, 2927, Sunset Boulevard, Silver Lake, Angelino Heights, LA, Los Angeles County, California, 90026, United States of America",California
356,ClaireCamden,-0.40000000596,0.40000000596,"Denver, CO",Louis C.K. is in deep shit https://t.co/3mF7vNhSXY,2017-11-15 10:03:20,"(Denver, Denver County, Colorado, United States of America, (39.7391536, -104.9847034))","Denver, Denver County, Colorado, United States of America",Colorado
